{
  "id": "2026-09-17-abschlusspruefung-und-lovable-umsetzung",
  "typ": "Tagesbericht",
  "datum": "2026-09-17",
  "titel": "Abschlussprüfung und Lovable-Umsetzung (L-1–L-4) – Auftragssammlung 15.09. abgeschlossen",
  "meta": {
    "teilnehmer": ["Bernd (Chat)"],
    "anlass": "Tagesabschluss 17.09.2026: technischer Umsetzungsstand der Auftragssammlung vom 15.09. abgeschlossen, Abschlussprüfung durchgeführt."
  },
  "abschnitte": [
    {
      "titel": "Zusammenfassung",
      "typ": "text",
      "inhalt": "Vier Lovable-Feldergänzungen (L-2, L-3, L-4) und der KI-Vorschlagsbutton (L-1) umgesetzt und getestet. Vier Claude-Code-Aufträge (CC-1–CC-4: Terminologie-Vereinheitlichung via PR #8, d009-Revision, Befund-4-Revision als D-010, D-009-Abgleich) abgeschlossen. Abschlussprüfung durchgeführt: main war kurzzeitig CI-rot (3 Prettier-Fehler), behoben (Commit 93b32e6), danach vollständig grün. L-1-Architektur empirisch verifiziert (API-Key serverseitig, vierfache Fallback-Absicherung, kein Autofill ohne Nutzeraktion). Sechs verwaiste Branches gelöscht, BACKLOG.md M1-006-Eintrag korrigiert."
    },
    {
      "titel": "Offene Punkte",
      "typ": "liste",
      "inhalt": [
        "L-7 (SystemCheck-Button gemeinsame Sitzung): Inhalt wartet auf Dieters Bestätigung.",
        "M1-007 (formelle Pilotentscheidung) durch Dieter ausstehend.",
        "Rollenmodell-Frage (Unternehmer/Führungskraft/Inhaber, RBAC-relevant) – für nächsten Dieter-Termin vorgemerkt.",
        "Keine offenen technischen Blocker."
      ]
    },
    {
      "titel": "Bezüge",
      "typ": "liste",
      "inhalt": ["CC-1", "CC-2", "CC-3", "CC-4", "L-1", "L-2", "L-3", "L-4", "D-009", "D-010", "M1-006", "M1-007"]
    }
  ]
}
